cuniID	year	title	googleScholarID	googleScholarTitle	harvestDate	citations	versions
557828	2018	Analysis of Word Order in Multiple Treebanks	10623327871189745428	Analysis of Word Order in Multiple Treebanks	2023-09-13	1	0
557850	2018	Topic-Focus Articulation: A Third Pillar of Automatic Evaluation of Text Coherence	4480533996015352370	Topic–focus articulation: a third pillar of automatic evaluation of text coherence	2023-09-13	4	0
557741	2018	A Baseline for General Music Object Detection with Deep Learning	16129800302652538213	A baseline for general music object detection with deep learning	2023-09-13	57	8
557814	2018	Využití velkých korpusů pro morfematickou analýzu českých slovesných předpon		Využití velkých korpusů pro morfematickou analýzu českých slovesných předpon	2023-09-13	0	0
573161	2018	The Forest Lion and the Bull: Morphosyntactic Annotation of the Panchatantra	8753385305802190920	The forest lion and the bull: Morphosyntactic annotation of the Panchatantra	2023-09-13	1	9
557739	2018	Pronominal Adverbs in German and their Equivalents in English, Czech and Russian: Evidence from the Parallel Corpus	5894520029825485782	Pronominal adverbs in German and their equivalents in enGlish, CzeCh and russian: evidenCe from the Parallel CorPus	2023-09-13	2	0
557740	2018	Analysis of coreferential expressions in PAWS			2023-09-13
557732	2018	Primary and secondary discourse connectives: definitions and lexicons	12945905861586626745	Primary and secondary discourse connectives: definitions and lexicons	2023-09-13	28	8
557798	2018	Cross-Tagset Parsing Evaluation for Russian		Cross-Tagset Parsing Evaluation for Russian	2023-09-13	0	3
557856	2018	The Correlation between Discourse-Anaphoric Devices and an Overall Communicative Competence in Learners' Essays	9502356281494787739	THE CORRELATION BETWEEN DISCOURSE-ANAPHORIC DEVICES AND AN OVERALL COMMUNICATIVE COMPETENCE IN LEARNERS'ESSAYS	2023-09-13	2	3
557861	2018	Practicing Students' Writing Skills through eLearning: Automated Evaluation of Text Coherence in Czech			2023-09-13
557792	2018	Discussion Group Summary: Optical Music Recognition	3270148151269148855	Discussion group summary: Optical music recognition	2023-09-13	1	2
557768	2018	Politician -- An Imitation Game	16121044986243193650	Politician–an imitation game	2023-09-13	2	3
557746	2018	Primary and secondary discourse connectives: Constraints and preferences	11324253622178829428	Primary and secondary discourse connectives: Constraints and preferences	2023-09-13	34	3
557750	2018	Derivation of Czech verbs and the category of aspect	18228783786138189069	Derivation of Czech verbs and the category of aspect	2023-09-13	6	4
557734	2018	Implementation of an Open Science Policy in the context of management of CLARIN language resources: a need for changes?					
573163	2018	The PARSEME multilingual corpus of verbal multiword expressions		The PARSEME multilingual corpus of verbal multiword expressions	2023-09-13	0	0
557735	2018	Mezi reflexivitou a reciprocitou: Poznámky k reflexivním a recipročním konstrukcím vybraných českých sloves	9018444092058548579	Mezi reflexivitou a reciprocitou: Poznámky k reflexivním a recipročním konstrukcím vybraných českých sloves	2023-09-13	2	0
557737	2018	Předložková vyjádření adnominálních valenčních doplnění	2360982716731611762	Předložková vyjádření adnominálních valenčních doplnění	2023-09-13	2	0
557744	2018	Aktant, nebo volné doplnění? (K netypickým formám ve valenčním poli substantiv)	16056385424253114567	Aktant, nebo volné doplnění?(K netypickým formám ve valenčním poli substantiv)	2023-09-13	3	0
557747	2018	A CROSS-LINGUAL SYNONYM CLASSES LEXICON	11996907268309693280	A Cross-lingual synonym classes lexicon	2023-09-13	5	0
557783	2018	Linguistically-based Deep Unstructured Question Answering	3654115340673574723	Linguistically-based deep unstructured question answering	2023-09-13	5	2
557863	2018	UDPipe 2.0 Prototype at CoNLL 2018 UD Shared Task	13992209581929077883	UDPipe 2.0 prototype at CoNLL 2018 UD shared task	2023-09-13	229	6
557788	2018	Using Adversarial Examples in Natural Language Processing			2023-09-13
557801	2018	Parse Me if You Can: Artificial Treebanks for Parsing Experiments on Elliptical Constructions			2023-09-13
557806	2018	Discourse Coherence Through the Lens of an Annotated Text Corpus: A Case Study	2867917837201605756	Discourse coherence through the lens of an annotated text corpus: A case study	2023-09-13	9	4
557813	2018	Bridging the LAPPS Grid and CLARIN	14629765862890396460	Bridging the LAPPS Grid and CLARIN	2023-09-13	5	13
557825	2018	Czech Legal Text Treebank 2.0			2023-09-13		
557829	2018	Semi-Automatic Construction of Word-Formation Networks (for Polish and Spanish)	821100629132449881	Semi-automatic construction of word-formation networks (for polish and spanish)	2023-09-13	13	0
557842	2018	ForFun 1.0: Prague Database of Forms and Functions -- An Invaluable Resource for Linguistic Research	18298780181516287519	ForFun 1.0: Prague Database of Forms and Functions–An Invaluable Resource for Linguistic Research	2023-09-13	1	3
557852	2018	Diacritics Restoration Using Neural Networks	11388066527097789402	Diacritics restoration using neural networks	2023-09-13	35	4
557864	2018	SumeCzech: Large Czech News-Based Summarization Dataset	9977183673009112807	Sumeczech: Large czech news-based summarization dataset	2023-09-13	21	0
557865	2018	Creating a Verb Synonym Lexicon Based on a Parallel Corpus	2673715086997436201	Creating a verb synonym lexicon based on a parallel corpus	2023-09-13	14	4
557867	2018	Tools for Building an Interlinked Multilingual Synonym Lexicon Network			2023-09-13		
557871	2018	Improving a Neural-based Tagger for Multiword Expression Identification			2023-09-13		
557799	2018	Data Conversion and Consistency of Monolingual Corpora: Russian UD Treebanks	16200817318688838271	Data conversion and consistency of monolingual corpora: Russian UD treebanks	2023-09-13	32	4
557807	2018	Universal Dependencies and Non-Native Czech		Universal Dependencies and a Non-Native Czech	2023-09-13	0	4
557841	2018	Reflexives in Universal Dependencies	1293448735758694983	Reflexives in Universal Dependencies	2023-09-13	3	5
557870	2018	Defining Verbal Synonyms: between Syntax and Semantics	7863770026417870231	Defining verbal synonyms: between syntax and semantics	2023-09-13	6	3
557826	2018	Phonetic Transcription by Untrained Annotators	12262563823419557675	Phonetic Transcription by Untrained Annotators	2023-09-13	1	2
557835	2018	Solving Three Czech NLP Tasks End-to-End with Neural Models	15172877702963645385	Solving Three Czech NLP Tasks with End-to-end Neural Models.	2023-09-13	5	6
557849	2018	A Study on Bilingually Informed Coreference Resolution		A Study on Bilingually Informed Coreference Resolution.	2023-09-13	0	4
557802	2018	Towards Full-Pipeline Handwritten OMR with Musical Symbol Detection by U-Nets	2071695484705768813	Towards Full-Pipeline Handwritten OMR with Musical Symbol Detection by U-Nets.	2023-09-13	37	4
557853	2018	Translating Short Segments with NMT: A Case Study in English-to-Hindi	11542924712264628279	Translating short segments with nmt: A case study in english-to-hindi	2023-09-13	6	12
557816	2018	Prefixal Morphemes of Czech Verbs		Prefixal Morphemes of Czech Verbs	2023-09-13	0	0
557838	2018	Morphological and Language-Agnostic Word Segmentation for NMT	12228842335314126591	Morphological and language-agnostic word segmentation for nmt	2023-09-13	23	3
557781	2018	Deep Neural Networks at the Service of Multilingual Parallel Sentence Extraction	13642304372526488075	Deep neural networks at the service of multilingual parallel sentence extraction	2023-09-13	12	3
557866	2018	Synonymy in Bilingual Context: The CzEngClass Lexicon	17372391245028722276	Synonymy in Bilingual Context: The CzEngClass Lexicon	2023-09-13	7	4
557796	2018	Are BLEU and Meaning Representation in Opposition?	9158420003658623306	Are BLEU and meaning representation in opposition?	2023-09-13	18	4
557803	2018	How current optical music recognition systems are becoming useful for digital libraries	10263137079597286974	How current optical music recognition systems are becoming useful for digital libraries	2023-09-13	10	4
557824	2018	LemmaTag: Jointly Tagging and Lemmatizing for Morphologically Rich Languages with BRNNs	9661485120860085638	Lemmatag: jointly tagging and lemmatizing for morphologically-rich languages with BRNNs	2023-09-13	38	7
557832	2018	End-to-End Non-Autoregressive Neural Machine Translation with Connectionist Temporal Classification	8061933980031139908	End-to-end non-autoregressive neural machine translation with connectionist temporal classification	2023-09-13	137	11
557855	2018	CUNI x-ling: Parsing under-resourced languages in CoNLL 2018 UD Shared Task	11147401896945887086	CUNI x-ling: Parsing under-resourced languages in CoNLL 2018 UD shared task	2023-09-13	11	7
557872	2018	CoNLL 2018 Shared Task: Multilingual Parsing from Raw Text to Universal Dependencies	12815994839541487485	CoNLL 2018 shared task: Multilingual parsing from raw text to universal dependencies	2023-09-13	582	27
557793	2018	A Morphological Analyzer for Shipibo-Konibo	1265554400206980425	A morphological analyzer for Shipibo-konibo	2023-09-13	11	6
557840	2018	Extracting Syntactic Trees from Transformer Encoder Self-Attentions	16211376488099700247	Extracting syntactic trees from transformer encoder self-attentions	2023-09-13	37	5
557847	2018	PAWS: A Multi-lingual Parallel Treebank with Anaphoric Relations	2326137729917533941	PAWS: A multi-lingual parallel treebank with anaphoric relations	2023-09-13	8	6
557848	2018	A Fine-grained Large-scale Analysis of Coreference Projection	10774998067345678447	A fine-grained large-scale analysis of coreference projection	2023-09-13	3	4
557827	2018	Second-Generation Web Interface to Correcting ASR Output			2023-09-13		
557843	2018	What Can We Find Out about Time and Space in the ForFun Database?			2023-09-13		
557786	2018	Expletives in Universal Dependency Treebanks	7604573473928827945	Expletives in universal dependency treebanks	2023-09-13	11	7
557794	2018	Challenges in Converting the Index Thomisticus Treebank into Universal Dependencies	18057106687729444875	Challenges in converting the Index Thomisticus treebank into universal dependencies	2023-09-13	26	10
557797	2018	Mind the Gap: Data Enrichment in Dependency Parsing of Elliptical Constructions	3338784256345183814	Mind the gap: Data enrichment in dependency parsing of elliptical constructions	2023-09-13	8	9
557818	2018	Trivial Transfer Learning for Low-Resource Neural Machine Translation	7398296665340743618	Trivial transfer learning for low-resource neural machine translation	2023-09-13	154	10
557833	2018	Input Combination Strategies for Multi-Source Transformer Decoder	13079892490408764840	Input combination strategies for multi-source transformer decoder	2023-09-13	73	13
557784	2018	Findings of the 2018 Conference on Machine Translation (WMT18)			2023-09-13		
557785	2018	EvalD Reference-Less Discourse Evaluation for WMT18	14710277086608720609	Evald reference-less discourse evaluation for wmt18	2023-09-13	13	6
557787	2018	The WMT'18 Morpheval test suites for English-Czech, English-German, English-Finnish and Turkish-English	15949100023944271025	The WMT'18 Morpheval test suites for English-Czech, English-German, English-Finnish and Turkish-English	2023-09-13	26	20
557795	2018	Testsuite on Czech-English Grammatical Contrasts	9917794133691525325	Testsuite on Czech–English grammatical contrasts	2023-09-13	8	5
557810	2018	CUNI System for the WMT18 Multimodal Translation Task	7256049717782983238	CUNI system for the WMT18 multimodal translation task	2023-09-13	77	21
557820	2018	CUNI Submissions in WMT18	5093081660643545097	Cuni submissions in wmt18	2023-09-13	7	6
557836	2018	Results of the WMT18 Metrics Shared Task: Both characters and embeddings achieve good performance	2117378212020078290	Results of the WMT18 metrics shared task: Both characters and embeddings achieve good performance	2023-09-13	104	5
557854	2018	CUNI Transformer Neural MT System for WMT18	5399415420810554257	CUNI transformer neural MT system for WMT18	2023-09-13	47	6
551979	2018	Quantitative Analysis of Syntactic Dependency in Czech	14848782543142864883	Quantitative analysis of syntactic dependency in Czech	2023-09-13	1	3
557772	2018	Konkurence předložkových pádů u jádra lokálních určení v češtině	6358796002914707788	Konkurence předložkových pádů u jádra lokálních určení v češtině	2023-09-13	1	0
573210	2018	Valency Lexicon of Czech Nouns NomVallex: Starting Point and Goals			2023-09-13		
557749	2018	Hranice flektivní a derivační morfologie: Případ předpony po- u českých sloves	13039907823388031268	Hranice flektivní a derivační morfologie: Případ předpony po-u českých sloves.	2023-09-13	1	3
557751	2018	Alternace konstrukcí s aktorem a instrumentem v paralelním česko-anglickém závislostním korpusu	18194509381453164917	Alternace konstrukcí s aktorem a instrumentem v paralelním česko-anglickém závislostním korpusu.	2023-09-13	3	3
557736	2018	Enriching VALLEX with Light Verbs: From Theory to Data and Back Again	14765697149862728545	Enriching VALLEX with light verbs: from theory to data and back again	2023-09-13	5	5
557738	2018	Search for the Relation of Form and Function Using the ForFun Database		Search for the Relation of Form and Function Using the ForFun Database	2023-09-13	0	4
557745	2018	Training Tips for the Transformer Model	17790115909320746734	Training tips for the transformer model	2023-09-13	315	5
557748	2018	Modelling Morphographemic Alternations in Derivation of Czech	342754153938204917	Modelling morphographemic alternations in derivation of Czech	2023-09-13	8	3
608132	2018	Adding Words to Manuscripts: From PagesXML to TEITOK	13867996587945830391	Adding words to manuscripts: From PagesXML to TEITOK	2023-09-13	4	2
557733	2018	Learning Audio-Sheet Music Correspondences for Cross-Modal Retrieval and Piece Identification	6358803260396542912	Learning audio–sheet music correspondences for cross-modal retrieval and piece identification	2023-09-13	56	6
557817	2018	Lexicographic Potential of the Syntactic Properties of Verbs: The Case of Reciprocity in Czech			2023-09-13		
557742	2018	Diateze a reciprocita (na materiálu češtiny)		DIATEZE A RECIPROCITA (na materiálu češtiny)	2023-09-13	0	2
557755	2018	Coreference from the Cross-lingual Perspective	18202020181918395084	Coreference from the Cross-lingual Perspective	2023-09-13	3	2
557756	2018	Diskurzní konektory v češtině: Od centra k periferii			2023-09-13		
560644	2018	Strojový překlad z vietnamštiny do češtiny pro účely Národní protidrogové centrály Policie ČR			2023-09-13		
557876	2018	Dávkový překlad IBM			2023-09-13		
557877	2018	Morphological Analyzer for Shipibo-Konibo	1265554400206980425	A morphological analyzer for Shipibo-konibo	2023-09-13	11	6
557878	2018	Czech Version of the Multi30k dataset			2023-09-13		
557879	2018	Czech image captioning, machine translation, and sentiment analysis (Neural Monkey models)			2023-09-13		
557880	2018	DATLOWE: software pro textovou analytiku			2023-09-13		
557881	2018	VALLEX 3.5 - Valenční slovník českých sloves			2023-09-13		
557883	2018	EVALD 3.0 - Evaluator of Discourse			2023-09-13		
557884	2018	PAWS	5774559466490493425	The feasibility of brief dog-assisted therapy on university students stress levels: The PAwS study	2023-09-13	93	7
557895	2018	Plaintext Wikipedia dump 2018			2023-09-13		
557896	2018	CzEngClass 0.1			2023-09-13		
557897	2018	CzEngClass 0.2			2023-09-13		
557922	2018	DeriNet verze 1.6			2023-09-13		
557928	2018	CoNLL 2018 Shared Task System Outputs			2023-09-13		
557929	2018	Enriched Discourse Annotation of PDiT Subset 1.0 (PDiT-EDA 1.0)			2023-09-13		
558221	2018	EVALD 3.0 for Foreigners - Evaluator of Discourse			2023-09-13		
560649	2018	VIADAT-SEARCH			2023-09-13		
560939	2018	HIDOAR - software pro polouatomatické zpracování a zpřístupnění textových a zvukových nahrávek v integrovaném archivu pramenů			2023-09-13		
573277	2018	Artificial Treebank with Ellipsis			2023-09-13		
573278	2018	Prague Dependency Treebank 3.5			2023-09-13		
593829	2018	POLISYS - analýza textových dat pro potřeby Policie ČR			2023-09-13		
